{
  "protocolVersion": "0.1",
  "objectType": "promotion_record",
  "promotionId": "x",
  "sourceRef": {
    "objectType": "x",
    "refId": "x",
    "digest": "sha256:0000000000000000000000000000000000000000000000000000000000000000"
  },
  "targetRef": {
    "objectType": "x",
    "refId": "x",
    "digest": "sha256:0000000000000000000000000000000000000000000000000000000000000000"
  },
  "from": "private",
  "to": "team",
  "transformations": [],
  "policyDecisionRef": "x",
  "consentRef": "x",
  "actor": {
    "actorId": "https://aen.dev/conformance/value",
    "type": "human"
  },
  "createdAt": "2026-08-19T00:00:00Z",
  "digest": "sha256:f88e7c3a8e154ff4ff6449d1be8b500beafc7cb07491f0d0a570e7dc09301095",
  "attestation": {
    "protocolVersion": "0.1",
    "objectType": "attestation",
    "attestationId": "att_fixture",
    "statementDigest": "sha256:4b069f82f37d6decb94b9821265dab99df5e2a475f0b9d1480928a683a1d620a",
    "envelope": {
      "payloadType": "application/vnd.in-toto+json",
      "payload": "eyJfdHlwZSI6Imh0dHBzOi8vaW4tdG90by5pby9TdGF0ZW1lbnQvdjEiLCJwcmVkaWNhdGUiOnsiaXNzdWVkQXQiOiIyMDI2LTA4LTE5VDAwOjAwOjAwWiIsImlzc3VlciI6eyJhY3RvcklkIjoiaHR0cHM6Ly9hZW4uZGV2L2NvbmZvcm1hbmNlL2FjdG9ycy9maXh0dXJlLW5vZGUiLCJ0eXBlIjoibm9kZSJ9LCJyb2xlIjoiY29uZm9ybWFuY2UtZml4dHVyZSIsInNjb3BlIjpbInB1YmxpYyJdfSwicHJlZGljYXRlVHlwZSI6Imh0dHBzOi8vYWVuLmRldi9hdHRlc3RhdGlvbnMvb2JqZWN0L3YwLjEiLCJzdWJqZWN0IjpbeyJkaWdlc3QiOnsic2hhMjU2IjoiZjg4ZTdjM2E4ZTE1NGZmNGZmNjQ0OWQxYmU4YjUwMGJlYWZjN2NiMDc0OTFmMGQwYTU3MGU3ZGMwOTMwMTA5NSJ9LCJuYW1lIjoicHJvbW90aW9uX3JlY29yZDp4In1dfQ==",
      "signatures": [
        {
          "keyid": "https://aen.dev/conformance/keys/fixture-ed25519",
          "sig": "67kwYSlXIdQk0ZwNdAaKLEng4a4boOCbmQ/Dclx1hPLaBECpkDACk/Erc27eP37mjkGcIzduThkQhF+a3rLgDQ==",
          "algorithm": "Ed25519"
        }
      ]
    },
    "issuer": {
      "actorId": "https://aen.dev/conformance/actors/fixture-node",
      "type": "node"
    },
    "issuedAt": "2026-08-19T00:00:00Z",
    "digest": "sha256:5e3995823dd9a010c557b9f310ab661780a9b2a4aec4168065cbc4977609f8f3"
  }
}
